{
  "beneficiary": { "type": "self" },
  "framed_requirements": {
    "need": "Everyday casual button-up shirts",
    "must_haves": ["natural / non-synthetic fabric"],
    "dealbreakers": ["polyester", "acrylic"],
    "budget": { "currency": "USD", "max": 150 },
    "region": "US"
  },
  "triage": { "stakes": "low", "reversibility": "easy", "commoditization": "mixed", "depth": "standard" },
  "candidates": [
    {
      "product": "Linen Camp Shirt",
      "maker": "MakerLinen",
      "durable_ids": { "unresolved": true, "unresolved_reason": "no GTIN/UPC published by maker for this colorway" },
      "evidence": [
        { "claim": "100% European flax linen, praised for durability", "source_cluster_id": "c1", "provenance": { "url": "https://example.com/linen", "owner": "OutletL", "access_tier": "fetch", "source_class": "professional_review" }, "independence_flag": true, "affiliate_or_sponsored_flag": false, "claim_confidence": 0.70 }
      ],
      "recurrence_over_clusters": 1
    },
    {
      "product": "Organic Cotton Oxford",
      "maker": "MakerCotton",
      "durable_ids": { "model_no": "OXF-ORG-01" },
      "evidence": [
        { "claim": "GOTS organic cotton, recurring pick in basics guides", "source_cluster_id": "c2", "provenance": { "url": "https://example.com/cotton", "owner": "OutletC", "access_tier": "fetch", "source_class": "editorial_roundup" }, "independence_flag": true, "affiliate_or_sponsored_flag": false, "claim_confidence": 0.75 }
      ],
      "recurrence_over_clusters": 2
    },
    {
      "product": "Poly-Blend Oxford",
      "maker": "MakerPoly",
      "durable_ids": { "model_no": "OXF-POLY-01" },
      "evidence": [
        { "claim": "Cheap and heavily reviewed, but a polyester/cotton blend", "source_cluster_id": "c3", "provenance": { "url": "https://example.com/poly", "owner": "OutletP", "access_tier": "fetch", "source_class": "editorial_roundup" }, "independence_flag": true, "affiliate_or_sponsored_flag": false, "claim_confidence": 0.55 }
      ],
      "recurrence_over_clusters": 1
    }
  ],
  "shortlist": [
    { "product": "Organic Cotton Oxford", "fundamentals_card": { "summary": "GOTS organic cotton, sturdy weave, repairable.", "fundamentals_score": 0.78, "fundamentals": [ { "dimension": "materials", "finding": "GOTS organic cotton" } ] } },
    { "product": "Linen Camp Shirt", "fundamentals_card": { "summary": "Breathable linen, fewer colorways.", "fundamentals_score": 0.72, "fundamentals": [ { "dimension": "materials", "finding": "European flax linen" } ] } },
    { "product": "Poly-Blend Oxford", "fundamentals_card": { "summary": "Polyester blend — does not clear the natural-materials filter.", "fundamentals_score": 0.4, "fundamentals": [ { "dimension": "materials", "finding": "Polyester/cotton blend (synthetic)" } ] }, "counterevidence": [ { "kind": "other", "detail": "Excluded — polyester violates the natural-materials dealbreaker (hard filter applied)", "source": "framed_requirements.dealbreakers" } ] }
  ],
  "pick": { "product": "Organic Cotton Oxford", "maker": "MakerCotton", "durable_ids": { "model_no": "OXF-ORG-01" } },
  "runners_up": [ { "product": "Linen Camp Shirt", "maker": "MakerLinen" } ],
  "rationale": "The poly-blend option is excluded by the natural-materials dealbreaker (hard filter applied); of the two that clear it, the cotton oxford recurs across more independent clusters and scores higher on fundamentals (weave, repairability).",
  "value_assessment": { "summary": "Good value under $150; natural fabric supports longevity.", "value_per_dollar": "high" },
  "offers": [
    { "merchant": "ExampleApparel", "price": 79, "currency": "USD", "provenance_tier": "fetch", "timestamp": "2026-06-22", "returns": "30-day", "offer_confidence": 0.55, "verify_at_checkout": true }
  ],
  "search_universe": { "queries_run": ["best organic cotton oxford shirt"], "sources_hit": ["OutletL", "OutletC"], "sources_failed_or_blocked": [], "tiers_unavailable": ["browser", "api"], "budgets_hit": [], "fetches_used": 4, "angles_swept": ["roundup", "community", "catalog"] },
  "outcome": "RECOMMEND_WITH_CAVEATS",
  "reason_code": "NONE",
  "confidence_overall": 0.70,
  "caveats": ["Apparel has fewer independent reviews than electronics; confidence moderate.", "Linen option's product identity is unresolved (no GTIN)."]
}
